{
  "$schema": "./docs/config.schema.json",
  "topic": "The topic your knowledge base is about (one line).",
  "domains": ["list", "the", "sub-areas", "facts", "split", "into"],

  "oracle": {
    "type": "none",
    "ref": "",
    "_comment": "Optional reference for provisional claim comparison. type: 'code' (a codebase/glob), 'api' (declared but not yet implemented), 'dataset' (a json/csv), or 'none'. Review oracle verdicts before relying on them."
  },

  "sources": [
    {
      "type": "web",
      "config": {
        "seeds": ["https://example.com/topic"],
        "maxPages": 50,
        "vision": true
      }
    },
    {
      "type": "youtube",
      "config": {
        "ids": [],
        "channels": [],
        "transcribe": "captions-then-whisper"
      }
    },
    {
      "type": "chat-export",
      "config": { "path": "raw/chat/*.json", "format": "generic" }
    },
    { "type": "pdf", "config": { "path": "raw/papers/*.pdf" } },
    { "type": "files", "config": { "path": "raw/docs/**/*.md" } }
  ],

  "compute": {
    "collect": {
      "baseURL": "https://openrouter.ai/api/v1",
      "model": "google/gemini-2.5-flash-lite",
      "keyEnv": "COLLECT_KEY"
    },
    "vision": {
      "baseURL": "https://openrouter.ai/api/v1",
      "model": "google/gemini-2.5-flash",
      "keyEnv": "COLLECT_KEY"
    },
    "analyze": {
      "baseURL": "https://openrouter.ai/api/v1",
      "model": "anthropic/claude-sonnet-5",
      "keyEnv": "ANALYZE_KEY"
    },
    "serve": {
      "baseURL": "https://openrouter.ai/api/v1",
      "model": "openai/gpt-5-mini",
      "keyEnv": "SERVE_KEY"
    }
  },

  "parallelism": { "waves": 3, "chunkChars": 12000 },
  "budget": { "maxCollectDocs": 500, "maxAnalyzeTokens": null },
  "language": "en",

  "privacy": { "secretsEnv": ".env", "gitignoreOutputs": true },

  "out": "out",

  "healthPing": {
    "enabled": false,
    "intervalMinutes": 1440,
    "canaries": ["Ask one known-answer question here to detect drift."]
  }
}
